{
  "$schema": "https://json-schema.org/draft/2020-12/schema",
  "$id": "https://folio.local/schemas/types/layer-stack.schema.json",
  "title": "Folio Layer Stack Authoring Input",
  "type": "object",
  "additionalProperties": false,
  "required": ["schema_version", "kind", "title", "layers", "flows"],
  "allOf": [{"if":{"properties":{"canvas":{"const":"poster"}},"required":["canvas"]},"else":{"properties":{"height":{"maximum":800}}}}],
  "properties": {
    "schema_version": {"const": "3.0"},
    "kind": {"const": "layer-stack"},
    "title": {"$ref": "#/$defs/non-empty-string"},
    "layers": {"type": "array", "minItems": 3, "maxItems": 7, "items": {"$ref": "#/$defs/layer"}},
    "flows": {"type": "array", "items": {"$ref": "#/$defs/flow"}},
    "canvas": {"enum": ["figure", "poster"]},
    "width": {"const": 960},
    "height": {"type": "integer", "minimum": 500, "maximum": 4000, "multipleOf": 4},
    "language": {"$ref": "#/$defs/nullable-string"}
  },
  "$defs": {
    "nullable-string": {"oneOf": [{"type": "null"}, {"$ref": "#/$defs/non-empty-string"}]},
    "non-empty-string": {"type": "string", "pattern": ".*\\S.*"},
    "layer": {
      "type": "object", "additionalProperties": false, "required": ["id", "label", "responsibility"],
      "properties": {
        "id": {"$ref": "#/$defs/non-empty-string"}, "label": {"$ref": "#/$defs/non-empty-string"},
        "responsibility": {"$ref": "#/$defs/non-empty-string"},
        "emphasis": {"enum": ["focal", "normal", "background"]}
      }
    },
    "flow": {
      "type": "object", "additionalProperties": false, "required": ["id", "source", "target", "channel"],
      "properties": {
        "id": {"$ref": "#/$defs/non-empty-string"}, "source": {"$ref": "#/$defs/non-empty-string"},
        "target": {"$ref": "#/$defs/non-empty-string"}, "channel": {"enum": ["request", "response"]},
        "label": {"type": ["string", "null"]}
      }
    }
  }
}
